{
  "schema_version": "answer-plan/v1",
  "plan_id": "fixture-web-needed-patch-metadata",
  "answer_mode": "web_needed",
  "intent": {
    "schema_version": "answer-intent/v1",
    "question_text": "最新パッチでこの技は変わった？",
    "normalized_question_text": "Latest patch metadata freshness check",
    "intent_kind": "web_needed",
    "answer_mode": "web_needed",
    "entities": {
      "character_slug": "ryu",
      "move_input": "2MP",
      "requested_field": "patch_metadata"
    }
  },
  "evidence_cards": [
    {
      "id": "official-web-patch-required",
      "evidence_family": "official_web",
      "authority_role": "official_metadata",
      "canonicality": "supplemental",
      "source_ref": {
        "label": "Official patch source required",
        "url": "https://www.streetfighter.com/6/"
      },
      "supports_exact_current_fact": false,
      "may_override_official_raw": false,
      "confidence": 0.6,
      "limitations": [
        "Official web may confirm patch metadata but cannot silently override packaged official_raw."
      ]
    }
  ],
  "web_research": {
    "web_required": true,
    "web_allowed": true,
    "web_used": false,
    "web_forbidden_for_current_fact_override": true,
    "conflict_requires_hold": true,
    "required_source_authority": "official_sources_required",
    "notes": "Use official sources for patch/current metadata and route conflicts to frame-data refresh."
  },
  "hold_reasons": [
    "freshness check requires official web source before user-facing patch metadata summary"
  ],
  "response_requirements": {
    "cite_evidence": true,
    "state_authority_boundary": true,
    "state_confidence": true,
    "boundary_notes": [
      "Web may be used for freshness and patch metadata only.",
      "Web must not override packaged official_raw exact current facts."
    ]
  }
}
